{
  "manifest_version": 1,
  "software": "cp2k",
  "software_version": "0.9.1",
  "generated_at": "2026-06-12T00:00:00Z",
  "sources": [
    {
      "source_ref": "raw/assets/agents.md",
      "kind": "agent-guidance",
      "path": "raw/assets/AGENTS.md",
      "sha256": "498d47546310ae81010d5462f45dd4977f5e8b5e84c1218c64a15ae956ed7286",
      "size_bytes": 1302,
      "version": "0.9.1",
      "confidence": 0.95,
      "notes": "Snapshot of agent workflow guidance used by the wiki."
    },
    {
      "source_ref": "raw/assets/changelog.md",
      "kind": "release-notes",
      "path": "raw/assets/CHANGELOG.md",
      "sha256": "cad9653696136214c547d534160957f8fe275cd2ed497610e82be4158b9567b7",
      "size_bytes": 6017,
      "version": "0.9.1",
      "confidence": 0.95
    },
    {
      "source_ref": "raw/assets/he_pbe.inp",
      "kind": "example",
      "path": "raw/assets/He_PBE.inp",
      "sha256": "2179908b2bc34ca60ecadca44ba7a750eb1d7dba4e63595e00f21e11082188ed",
      "size_bytes": 712,
      "version": "0.9.1",
      "confidence": 0.95
    },
    {
      "source_ref": "raw/assets/makefile",
      "kind": "source",
      "path": "raw/assets/Makefile",
      "sha256": "8b6587b859607f200f116e2cb043fc358e1c3a26c326b563bf348453cfc68307",
      "size_bytes": 634,
      "version": "0.9.1",
      "confidence": 0.9
    },
    {
      "source_ref": "raw/assets/nacl.inp",
      "kind": "example",
      "path": "raw/assets/NaCl.inp",
      "sha256": "88b21ee681ae9c3b812a777003a67018242b23a4216508b620651b5c7b32b506",
      "size_bytes": 3660,
      "version": "0.9.1",
      "confidence": 0.95
    },
    {
      "source_ref": "raw/assets/readme.md",
      "kind": "documentation",
      "path": "raw/assets/README.md",
      "sha256": "9b7db814a775043ef1c39427b25404f432b803ae83e299c813eb3af510657fa3",
      "size_bytes": 16488,
      "version": "0.9.1",
      "confidence": 0.95
    },
    {
      "source_ref": "raw/assets/agent-workflow.md",
      "kind": "agent-guidance",
      "path": "raw/assets/agent-workflow.md",
      "sha256": "9c030584e542602f3ad3b069b9748031d0f707ff706e9b0cab2bb2ffc5b73dff",
      "size_bytes": 5498,
      "version": "0.9.1",
      "confidence": 0.95
    },
    {
      "source_ref": "raw/assets/cli.rst",
      "kind": "documentation",
      "path": "raw/assets/cli.rst",
      "sha256": "196dea5c7d38611979c27564772ec0a9b3dd4d414477da5e4b43e1247fecb72b",
      "size_bytes": 726,
      "version": "0.9.1",
      "confidence": 0.9
    },
    {
      "source_ref": "raw/assets/conf.py",
      "kind": "source",
      "path": "raw/assets/conf.py",
      "sha256": "764795398283d875008e787936a368c55dcbf5b11b9efb126bff042f29a21f6b",
      "size_bytes": 3566,
      "version": "0.9.1",
      "confidence": 0.9
    },
    {
      "source_ref": "raw/assets/index.rst",
      "kind": "documentation",
      "path": "raw/assets/index.rst",
      "sha256": "2b388bc4cfb27cff42b072fc38fd533ddbad97ef293d772e1b8c5b6eb2334c69",
      "size_bytes": 543,
      "version": "0.9.1",
      "confidence": 0.9
    },
    {
      "source_ref": "raw/assets/requirements.txt",
      "kind": "source",
      "path": "raw/assets/requirements.txt",
      "sha256": "ea491c42e47f5edf5084fb204cccc2833e847fed66571eb35f22c8235c78827e",
      "size_bytes": 13,
      "version": "0.9.1",
      "confidence": 0.9
    },
    {
      "source_ref": "raw/assets/contributing.md",
      "kind": "documentation",
      "path": "raw/assets/CONTRIBUTING.md",
      "sha256": "59ddba4a0c8eb689c8a8a16ac5e1be59b33c7901cbb2ad4f3fb3bb02d5d5f012",
      "size_bytes": 1321,
      "version": "0.9.1",
      "confidence": 0.9
    },
    {
      "source_ref": "raw/assets/cp2k-dft-qs-reference.md",
      "kind": "documentation",
      "path": "raw/assets/cp2k-dft-qs-reference.md",
      "sha256": "55098437f389d7b418916011af239aae6f7223865a34aedac7394be5b877d4cc",
      "size_bytes": 8529,
      "version": "0.9.1",
      "confidence": 0.9
    },
    {
      "source_ref": "raw/assets/cp2k-input-sections-reference.md",
      "kind": "documentation",
      "path": "raw/assets/cp2k-input-sections-reference.md",
      "sha256": "ccdf81420c67640a198513845f15310a1ce931c6de6263ecffe8a7a96a393549",
      "size_bytes": 7157,
      "version": "0.9.1",
      "confidence": 0.9
    },
    {
      "source_ref": "raw/assets/cp2k-md-tutorials.md",
      "kind": "documentation",
      "path": "raw/assets/cp2k-md-tutorials.md",
      "sha256": "668f367959d68f544b0f037b40833d6ff881265a1ba91f95916b6d84121ed1c3",
      "size_bytes": 9311,
      "version": "0.9.1",
      "confidence": 0.9
    },
    {
      "source_ref": "raw/assets/cp2k-ml-potentials.md",
      "kind": "documentation",
      "path": "raw/assets/cp2k-ml-potentials.md",
      "sha256": "2decf64bc68b4de6aea5bad075620b83bb3810cf9ab8506907d4a95c9d341658",
      "size_bytes": 10555,
      "version": "0.9.1",
      "confidence": 0.9
    },
    {
      "source_ref": "raw/assets/cp2k-output-format.md",
      "kind": "documentation",
      "path": "raw/assets/cp2k-output-format.md",
      "sha256": "ea633c6bd665dc1193ce1a40759c61d99d155942690234572e9e54e6d76053a6",
      "size_bytes": 8890,
      "version": "0.9.1",
      "confidence": 0.9
    },
    {
      "source_ref": "raw/assets/upstream-cp2k-reference.md",
      "kind": "documentation",
      "path": "raw/assets/upstream-cp2k-reference.md",
      "sha256": "25e2f901fceb3c65f1876f22e8fec6d3131c21f7b20f31652d47bec338188564",
      "size_bytes": 2837,
      "version": "0.9.1",
      "confidence": 0.95,
      "notes": "Upstream CP2K documentation link manifest for issue #109 closeout."
    },
    {
      "source_ref": "raw/assets/example-nvt-md.inp",
      "kind": "example",
      "path": "raw/assets/example-nvt-md.inp",
      "sha256": "f945c3453c663fc86c5a269359cad5457718f995b7f004a0a3ff65799ed8832e",
      "size_bytes": 1150,
      "version": "0.9.1",
      "confidence": 0.9,
      "notes": "Minimal NVT MD example derived from official CP2K MOTION/MD reference."
    },
    {
      "source_ref": "cp2k_input_tools/cp2k_input.xml",
      "kind": "schema",
      "path": "cp2k_input_tools/cp2k_input.xml",
      "sha256": "258e45be04fe333beecca43dd0748d669d5fe1ebb0e23d43b97902a0151634ac",
      "size_bytes": 27459375,
      "version": "0.9.1",
      "confidence": 0.95,
      "notes": "Existing tracked keyword registry; intentionally not duplicated under raw/assets."
    },
    {
      "source_ref": "raw/assets/asset-manifest.json",
      "kind": "schema",
      "path": "raw/assets/asset-manifest.json",
      "sha256": "6c9b86f12b98b173735b0bb35c13f9fa7bf7d64a5d8f52034a6ae7c919449e1c",
      "size_bytes": 2059,
      "version": "0.9.1",
      "confidence": 0.95,
      "notes": "OpenQC LSP asset manifest added for fixture/provenance gate evidence."
    },
    {
      "source_ref": "raw/assets/manifest.json",
      "kind": "schema",
      "path": "raw/assets/manifest.json",
      "sha256": "742c9afebceb56a7d25933b26eb4f2201236844eba83c15a752abc3e8fd12eb3",
      "size_bytes": 3509,
      "version": "0.9.1",
      "confidence": 0.95,
      "notes": "Generated raw asset manifest consumed by the OpenQC traceability report."
    }
  ]
}
